{
  "$schema": "./ownership-registry.schema.json",
  "schemaVersion": 1,
  "registryId": "menq.design.governance.ownership.v1",
  "part": "Part 14",
  "canonicalSource": "platforms/design/governance/ownership-registry.json",
  "escalation": {
    "ownerId": "owner.menq",
    "rule": {
      "hy": "Owner-ի բացակայության կամ conflict-ի դեպքում որոշումը փոխանցվում է MenQ Owner-ին։",
      "en": "If an owner is unavailable or in conflict, the decision escalates to the MenQ Owner."
    }
  },
  "assets": [
    {
      "id": "menq.design.spec.brand-core.v1",
      "kind": "specification",
      "path": "platforms/design/ARCHITECTURE.md",
      "ownerId": "owner.menq",
      "backupOwnerId": "owner.menq",
      "lifecycle": "Approved — Implementing",
      "reviewCadence": "per-release",
      "affectedConsumers": [
        "menq.design.consumer.catalog",
        "menq.design.consumer.release-console"
      ],
      "changeAuthority": "owner",
      "description": {
        "hy": "Brand Core սահմաններ specification",
        "en": "Brand Core Boundaries specification"
      }
    },
    {
      "id": "menq.design.spec.tokens.v1",
      "kind": "specification",
      "path": "platforms/design/DESIGN_PLATFORM_ARCHITECTURE_BASELINE_V1.md",
      "ownerId": "owner.design-platform-maintainer",
      "backupOwnerId": "owner.menq",
      "lifecycle": "Approved — Implementing",
      "reviewCadence": "per-release",
      "affectedConsumers": [
        "menq.design.consumer.catalog",
        "menq.design.consumer.release-console"
      ],
      "changeAuthority": "maintainer",
      "description": {
        "hy": "Token ճարտարապետություն specification",
        "en": "Token Architecture specification"
      }
    },
    {
      "id": "menq.design.spec.foundations.v1",
      "kind": "specification",
      "path": "platforms/design/DESIGN_PLATFORM_ARCHITECTURE_BASELINE_V1.md",
      "ownerId": "owner.design-platform-maintainer",
      "backupOwnerId": "owner.menq",
      "lifecycle": "Approved — Implementing",
      "reviewCadence": "per-release",
      "affectedConsumers": [
        "menq.design.consumer.catalog",
        "menq.design.consumer.release-console"
      ],
      "changeAuthority": "maintainer",
      "description": {
        "hy": "Դիզայնի հիմքեր specification",
        "en": "Design Foundations specification"
      }
    },
    {
      "id": "menq.design.spec.primitives.v1",
      "kind": "specification",
      "path": "platforms/design/CONTRACTS.md",
      "ownerId": "owner.design-platform-maintainer",
      "backupOwnerId": "owner.menq",
      "lifecycle": "Approved — Implementing",
      "reviewCadence": "per-release",
      "affectedConsumers": [
        "menq.design.consumer.catalog",
        "menq.design.consumer.release-console"
      ],
      "changeAuthority": "maintainer",
      "description": {
        "hy": "UI primitive-ներ specification",
        "en": "UI Primitives specification"
      }
    },
    {
      "id": "menq.design.spec.components.v1",
      "kind": "specification",
      "path": "platforms/design/CONTRACTS.md",
      "ownerId": "owner.design-platform-maintainer",
      "backupOwnerId": "owner.menq",
      "lifecycle": "Approved — Implementing",
      "reviewCadence": "per-release",
      "affectedConsumers": [
        "menq.design.consumer.catalog",
        "menq.design.consumer.release-console"
      ],
      "changeAuthority": "maintainer",
      "description": {
        "hy": "Component contract-ներ specification",
        "en": "Component Contracts specification"
      }
    },
    {
      "id": "menq.design.spec.patterns.v1",
      "kind": "specification",
      "path": "platforms/design/CONTRACTS.md",
      "ownerId": "owner.design-platform-maintainer",
      "backupOwnerId": "owner.menq",
      "lifecycle": "Approved — Implementing",
      "reviewCadence": "per-release",
      "affectedConsumers": [
        "menq.design.consumer.catalog",
        "menq.design.consumer.release-console"
      ],
      "changeAuthority": "maintainer",
      "description": {
        "hy": "Pattern contract-ներ specification",
        "en": "Pattern Contracts specification"
      }
    },
    {
      "id": "menq.design.spec.assets.v1",
      "kind": "specification",
      "path": "platforms/design/DESIGN_PLATFORM_ARCHITECTURE_BASELINE_V1.md",
      "ownerId": "owner.design-platform-maintainer",
      "backupOwnerId": "owner.menq",
      "lifecycle": "Approved — Implementing",
      "reviewCadence": "per-release",
      "affectedConsumers": [
        "menq.design.consumer.catalog",
        "menq.design.consumer.release-console"
      ],
      "changeAuthority": "maintainer",
      "description": {
        "hy": "Asset governance specification",
        "en": "Asset Governance specification"
      }
    },
    {
      "id": "menq.design.spec.motion.v1",
      "kind": "specification",
      "path": "platforms/design/DESIGN_PLATFORM_ARCHITECTURE_BASELINE_V1.md",
      "ownerId": "owner.design-platform-maintainer",
      "backupOwnerId": "owner.menq",
      "lifecycle": "Approved — Implementing",
      "reviewCadence": "per-release",
      "affectedConsumers": [
        "menq.design.consumer.catalog",
        "menq.design.consumer.release-console"
      ],
      "changeAuthority": "maintainer",
      "description": {
        "hy": "Motion contract-ներ specification",
        "en": "Motion Contracts specification"
      }
    },
    {
      "id": "menq.design.spec.locales.v1",
      "kind": "specification",
      "path": "platforms/design/CONTRACTS.md",
      "ownerId": "owner.design-platform-maintainer",
      "backupOwnerId": "owner.menq",
      "lifecycle": "Approved — Implementing",
      "reviewCadence": "per-release",
      "affectedConsumers": [
        "menq.design.consumer.catalog",
        "menq.design.consumer.release-console"
      ],
      "changeAuthority": "maintainer",
      "description": {
        "hy": "Լոկալիզացիայի contract-ներ specification",
        "en": "Localization Contracts specification"
      }
    },
    {
      "id": "menq.design.spec.validation.v1",
      "kind": "specification",
      "path": "platforms/design/VALIDATION_CI_CONFORMANCE_QUALITY_GATES_ARCHITECTURE_V1.md",
      "ownerId": "owner.design-platform-maintainer",
      "backupOwnerId": "owner.menq",
      "lifecycle": "Approved — Implementing",
      "reviewCadence": "per-release",
      "affectedConsumers": [
        "menq.design.consumer.catalog",
        "menq.design.consumer.release-console"
      ],
      "changeAuthority": "maintainer",
      "description": {
        "hy": "Validation և conformance specification",
        "en": "Validation and Conformance specification"
      }
    },
    {
      "id": "menq.design.spec.documentation.v1",
      "kind": "specification",
      "path": "platforms/design/DOCUMENTATION_PORTAL_COMPONENT_CATALOG_DESIGN_TOOL_INTEGRATION_ARCHITECTURE_V1.md",
      "ownerId": "owner.design-platform-maintainer",
      "backupOwnerId": "owner.menq",
      "lifecycle": "Approved — Implementing",
      "reviewCadence": "per-release",
      "affectedConsumers": [
        "menq.design.consumer.catalog",
        "menq.design.consumer.release-console"
      ],
      "changeAuthority": "maintainer",
      "description": {
        "hy": "Documentation և catalog specification",
        "en": "Documentation and Catalog specification"
      }
    },
    {
      "id": "menq.design.spec.governance.v1",
      "kind": "specification",
      "path": "platforms/design/GOVERNANCE_CONTRIBUTION_OWNERSHIP_CHANGE_REQUEST_LIFECYCLE_ARCHITECTURE_V1.md",
      "ownerId": "owner.menq",
      "backupOwnerId": "owner.menq",
      "lifecycle": "Locked",
      "reviewCadence": "per-release",
      "affectedConsumers": [
        "menq.design.consumer.catalog",
        "menq.design.consumer.release-console"
      ],
      "changeAuthority": "owner",
      "description": {
        "hy": "Governance և change lifecycle specification",
        "en": "Governance and Change Lifecycle specification"
      }
    },
    {
      "id": "menq.design.spec.adoption.v1",
      "kind": "specification",
      "path": "platforms/design/PRODUCT_ADOPTION_MATURITY_MODEL_TWO_CONSUMER_VALIDATION_PLAN_V1.md",
      "ownerId": "owner.menq",
      "backupOwnerId": "owner.menq",
      "lifecycle": "Approved — Implementing",
      "reviewCadence": "per-release",
      "affectedConsumers": [
        "menq.design.consumer.catalog",
        "menq.design.consumer.release-console"
      ],
      "changeAuthority": "owner",
      "description": {
        "hy": "Product adoption և consumer validation specification",
        "en": "Product Adoption and Consumer Validation specification"
      }
    },
    {
      "id": "menq.design.spec.packaging.v1",
      "kind": "specification",
      "path": "platforms/design/CANONICAL_SPECIFICATION_INDEX_IMPLEMENTATION_PACKAGE_PLAN_V1.md",
      "ownerId": "owner.design-platform-maintainer",
      "backupOwnerId": "owner.menq",
      "lifecycle": "Approved — Implementing",
      "reviewCadence": "per-release",
      "affectedConsumers": [
        "menq.design.consumer.catalog",
        "menq.design.consumer.release-console"
      ],
      "changeAuthority": "maintainer",
      "description": {
        "hy": "Packaging և release specification",
        "en": "Packaging and Release specification"
      }
    },
    {
      "id": "menq.design.spec.brand-expression.v1",
      "kind": "specification",
      "path": "platforms/design/decisions/D-027-MENQ-BRAND-EXPRESSION-LAYER-V1.md",
      "ownerId": "owner.menq",
      "backupOwnerId": "owner.menq",
      "lifecycle": "Draft",
      "reviewCadence": "per-release",
      "affectedConsumers": [
        "menq.design.consumer.catalog",
        "menq.design.consumer.release-console"
      ],
      "changeAuthority": "owner",
      "description": {
        "hy": "Բրենդային արտահայտման շերտ specification",
        "en": "Brand Expression Layer specification"
      }
    },